commit	composite_score	mean_reward	memory_gb	status	description	e2e_seconds	api_cost_usd	cogs_junctions_held	cogs_junctions_aligned	clips_junctions_held	aligned_by_agent	scrambled_by_agent	cells_visited	deaths	move_success	move_failed	vibe_changes	carbon_deposited	carbon_amount	oxygen_amount	silicon_amount	germanium_amount	heart_amount	miner_gained	aligner_gained	scrambler_gained	scout_gained
                                                                                                                                                                                                                                                                                                                                                                                                                                                                                       5419cb7	0.000000	0.000000	0.000	crash	ent=0.10 + dual_LR(0.001/0.0003) 20min — CRASH: checkpoint write collision with parallel loop; entropy=1.60 stable before crash; DISK QUOTA hit from 1413 accumulated checkpoints	420																					
ae6f8d2	0.000000	0.000000	0.000	discard	ent=0.10 + dual_LR(policy=0.001,value=0.0003) 20min bptt=64 — dual_LR HURTS: ev=-1.92 (value not learning), junctions=77 mean (vs 166.6 without dual_LR). value_lr=0.0003 too low for ent=0.10 config	1241		77.1																			
ae6f8d2	68.929640	68.929640	0.000	keep	milestones_2:25 + role_cond + penalize_vibe ent=0.10 single_LR=0.001 gae=0.95 bptt=64 20min — reproducing parallel-loop best (73.5) to confirm ent=0.10 baseline; dual LR disqualified (ev=-1.92)	1238			552.6	0.0	1202321.5	0.1	0.0	2839571.9	3.6	4676.6	3453.6	0.0	3.7	5.6	12.0	7.1	3.5	1.0	0.4	0.3	0.3	0.3
3d289e9	62.255358	62.255358	0.000	keep	milestones_2:25 + role_cond + penalize_vibe ent=0.15 clip_coef=0.1 lr=0.001 bptt=64 25min — conservative PPO clip to fight 30min overtraining; baseline 20min=541j, 30min=61j	1530			261.4	0.0	1191484.4	0.1	0.0	2576977.6	2.0	4685.2	3391.7	0.0	4.0	5.1	6.5	3.9	5.0	0.4	0.2	0.3	0.1	0.3
44a42ab	80.825631	80.825631	0.000	keep	milestones_2:25 + role_cond + penalize_vibe ent=0.10 lr=0.001 bptt=64 25min — extend best 20min config (ent=0.10, 552.6j) to 25min; testing if lower entropy delays overtraining vs ent=0.15 collapse at 30min	1547			390.0	0.0	1194905.1	0.0	0.0	2975900.3	2.7	4567.1	3539.5	0.0	3.2	9.2	10.1	8.2	6.8	2.0	0.3	0.2	0.3	0.3
4beabbb	69.162233	69.162233	0.000	keep	milestones_2:25 + role_cond + penalize_vibe ent=0.10 lr=0.001 bptt=64 update_epochs=2 20min — 2 PPO sweeps per rollout for better sample efficiency; baseline 20min=552.6j (ae6f8d2)	1241			202.6	0.0	1195701.2	0.0	0.0	2808521.4	3.6	4637.5	3498.4	0.0	4.0	6.0	5.4	9.1	10.8	3.4	0.3	0.4	0.5	0.2
6d2479b	48.698025	48.698025	0.000	keep	milestones_2:25 + role_cond + penalize_vibe ent=0.10 lr=0.001 bptt=64 clip=0.3 20min — more aggressive PPO clip (0.2->0.3) for faster consolidation; baseline 20min=552.6j (ae6f8d2)	1249			148.9	0.0	1199387.1	0.1	0.0	2056084.7	2.1	4510.2	3572.8	0.0	6.0	5.6	4.9	3.8	3.9	1.0	0.1	0.1	0.1	0.2
c4e352a	63.788525	63.788525	0.000	discard	milestones_2:25 + role_cond + penalize_vibe ent=0.10 cosine_lr 0.001->0.00005 bptt=64 20min — cosine LR decay to fight overtraining; baseline 20min=552.6j (ae6f8d2)	1269			394.2	0.0	1189279.2	0.0	0.0	2443355.2	1.5	4485.0	3616.0	0.0	3.0	4.9	4.6	7.4	6.6	1.0	0.2	0.2	0.2	0.1
2524a23	44.265624	44.265624	0.000	discard	milestones_2:25 + role_cond + penalize_vibe ent=0.159 lr=0.0013 bptt=64 20min — PBT-validated hyperparams (cycle 1 winner); baseline 20min=552.6j (ae6f8d2)	1251			91.5	0.0	1189770.2	0.0	0.0	2082031.8	2.0	4734.1	3337.6	0.0	5.0	4.6	2.0	8.6	4.8	0.1	0.4	0.2	0.5	0.2
9f3297d	80.170776	80.170776	0.000	keep	milestones_2:25 + role_cond + penalize_vibe ent=0.10 lr=0.0005 bptt=64 25min — half LR to fight overtraining; baseline: 20min=552.6j, 25min=390.0j (4beabbb)	1553			6.4	0.0	1194615.0	0.0	0.0	2786817.3	2.0	4535.8	3547.0	0.0	2.0	2.1	3.6	8.5	2.5	2.2	0.4	0.4	0.4	0.4
4794d53	69.146168	69.146168	0.000	keep	milestones_2:25 + role_cond + penalize_vibe ent=0.10 lr=0.001 bptt=64 gae=0.98 20min — longer credit horizon; PBT session found gae=0.98 is preferred; baseline 20min=552.6j (ae6f8d2)	1251			447.5	0.0	1194105.0	0.1	0.0	2449003.8	3.0	4777.3	3262.8	0.0	0.0	2.0	5.0	6.1	6.2	1.2	0.3	0.5	0.4	0.3
950f6d9	82.289680	82.289680	0.000	keep	milestones_2:25 + role_cond + penalize_vibe ent_anneal=0.15→0.05 lr=0.001 bptt=64 gae=0.95 25min — entropy annealing to combat overtraining; baseline 20min=552.6j 25min=390.0j (ae6f8d2/4beabbb)	1559			352.8	0.0	1203234.0	0.1	0.0	3096218.7	2.3	4213.1	3947.7	0.0	0.0	7.8	12.6	6.5	7.4	1.5	0.2	0.2	0.2	0.2
a0c2824	80.853070	80.853070	0.000	keep	milestones_2:25 + role_cond + penalize_vibe ent_anneal=0.1→0.03 lr=0.001 bptt=64 gae=0.95 25min — start from optimal ent=0.10, aggressive decay to 0.03; prev 0.15→0.05=352.8j (a0c2824)	1565			0.0	0.0	1197097.5	0.0	0.0	3110337.6	3.8	3527.6	4625.8	0.0	3.7	9.9	15.0	9.6	8.8	1.0	0.2	0.2	0.2	0.1
95a435d	64.335540	64.335540	0.000	keep	milestones_2:25 + role_cond + penalize_vibe hidden_size=512 ent=0.10 lr=0.001 bptt=64 gae=0.95 20min — larger LSTM (2x, 512 vs 256), all hyperparams at best-known; baseline 20min=552.6j (ae6f8d2)	1269			0.0	0.0	1196417.9	0.0	0.0	2396839.0	3.1	4469.2	3654.0	0.0	1.0	3.5	4.9	13.0	4.9	2.4	0.4	0.4	0.4	0.3
a0dd59e	63.372697	63.372697	0.000	keep	milestones_2:25 + role_cond + penalize_vibe minibatch=4096 ent=0.10 lr=0.001 bptt=64 gae=0.95 20min — half minibatch vs baseline (4096 vs 8192); more gradient updates per epoch; baseline 20min=552.6j (ae6f8d2)	1253			53.9	0.0	1202856.4	0.0	0.0	2681924.9	2.8	4646.2	3487.5	0.0	11.0	9.4	2.9	6.0	5.8	1.9	0.4	0.4	0.5	0.3
1418b92	67.687998	67.687998	0.000	keep	milestones_2:50 + role_cond + penalize_vibe ent=0.10 lr=0.001 bptt=64 gae=0.95 25min — doubled milestone weight (:50 vs :25) to strengthen junction signal and reduce overtraining; baseline 25min=390j (4beabbb), 20min=552j (ae6f8d2)	1554			10.4	0.0	1189600.0	0.0	0.0	2823984.0	3.1	4584.8	3500.8	0.0	5.0	13.9	11.9	13.6	10.9	2.5	0.2	0.1	0.2	0.1
f530e5b	37.452602	37.452602	0.000	discard	milestones_2:25 + role_cond + penalize_vibe ent=0.10 lr_warmup=0.0001→0.001 bptt=64 gae=0.95 25min — LR warmup over 5min then constant; baseline 25min=390j (4beabbb), 20min=552j (ae6f8d2)	1552			99.4	0.0	1195507.1	0.0	0.0	1577638.0	1.7	4586.8	3524.8	0.0	2.4	4.9	4.5	3.2	2.2	0.2	0.3	0.2	0.3	0.2
167ca19	75.168500	75.168500	0.000	discard	milestones_2:25 + role_cond + penalize_vibe ent=0.10 gamma=0.99 lr=0.001 bptt=64 gae=0.95 20min — gamma 0.999→0.99 shorter horizon test; baseline 20min=552j (ae6f8d2)	1241			124.1	0.0	1199653.4	0.1	0.0	2830165.9	3.4	4660.3	3467.1	0.0	1.8	4.4	3.8	2.6	3.5	0.1	0.3	0.2	0.3	0.3
f5fb0c6	0.183008	0.183008	0.000	discard	milestones_2:25 + penalize_vibe (no role_conditional) ent=0.10 gamma=0.999 lr=0.001 bptt=64 gae=0.95 20min — drop role_cond to simplify reward signal; baseline 20min=552j (ae6f8d2)	1241			41.9	0.0	1202365.1	0.1	0.0	2015136.1	3.4	5133.4	2881.0	0.0	12.5	7.4	14.8	8.8	3.2	0.1	0.4	0.3	0.4	0.4
fd4e9cc	81.588441	81.588441	0.000	discard	milestones_2:25 + role_conditional (no penalize_vibe) ent=0.10 gamma=0.999 lr=0.001 bptt=64 gae=0.95 25min — drop penalize_vibe to reduce long-run overtraining; baseline 20min=552j (ae6f8d2) 25min=390j (4beabbb)	1552			0.0	0.0	1194105.0	0.0	0.0	2971036.5	2.2	4545.9	3560.1	0.0	0.0	5.9	4.6	7.1	5.1	1.6	0.3	0.2	0.3	0.1
9c9c7f1	71.306253	71.306253	0.000	discard	milestones_2:25 + role_conditional + penalize_vibe ent=0.05 gamma=0.999 lr=0.001 bptt=64 gae=0.95 25min — lower entropy to constrain policy divergence at 25min; ent=0.10 at 25min=390j (4beabbb) baseline	1547			0.0	0.0	1193231.7	0.0	0.0	3007566.4	3.7	4105.8	4069.8	0.0	2.3	9.6	13.5	8.4	9.8	2.5	0.3	0.2	0.3	0.3
bbf754d	71.898358	71.898358	0.000	discard	milestones_2:25 + role_conditional + penalize_vibe ent=0.10 gamma=0.999 lr=0.001 bptt=64 gae=0.95 minibatch=16384 20min — double minibatch halves gradient updates per rollout; update_epochs=2 failed (more updates=bad), so fewer updates might help; baseline 20min=552j (ae6f8d2)	1241			27.2	0.0	1195705.2	0.1	0.0	2455827.2	3.3	4663.4	3406.0	0.0	5.0	1.6	0.5	5.1	5.6	1.4	0.3	0.5	0.5	0.3
aed9ceb	50.244423	50.244423	0.000	keep	milestones_2:25 + role_conditional + penalize_vibe ent=0.10 gamma=0.999 lr=0.001→0.0001 step@20min bptt=64 gae=0.95 minibatch=8192 25min — step LR: full 0.001 for 20min, drop 10x to 0.0001 for final 5min; cosine over 20min failed (394j); const 0.001 at 25min=390j; hypothesis: keep full LR for learning phase, tiny LR to consolidate without overtraining	1553			190.0	0.0	1202856.4	0.0	0.0	2484001.5	1.7	4303.0	3773.8	0.0	5.3	8.1	6.9	9.9	7.9	1.9	0.2	0.3	0.3	0.1
a7c05f0	74.928850	74.928850	0.000	keep	milestones_2:25 + role_conditional + penalize_vibe ent=0.10 gamma=0.999 lr=0.001 max_grad_norm=0.5 bptt=64 gae=0.95 minibatch=8192 25min — max_grad_norm=0.5 (from 1.5 default); standard PPO uses 0.5; hypothesis: current 1.5 allows too-large gradient steps causing policy divergence after 20min; stricter clipping should slow overtraining	1553			136.2	0.0	1195717.8	0.1	0.0	2799636.5	2.1	4586.3	3526.2	0.0	2.3	5.1	3.6	2.5	2.5	0.5	0.4	0.2	0.3	0.4
fd36c23	55.689015	55.689015	0.000	keep	milestones_2:25 + role_conditional + penalize_vibe ent=0.10 gamma=0.999 lr=0.001 adam_beta1=0.9 bptt=64 gae=0.95 minibatch=8192 25min — adam_beta1=0.9 (cogames default is 0.95, non-standard); high momentum may cause optimizer to overshoot at longer runs; standard beta1=0.9 should reduce accumulated gradient drift and delay overtraining past 20min; max_grad_norm restored to 1.5	1559			240.8	0.0	1195506.4	0.0	0.0	2296686.8	2.3	4636.4	3509.5	0.0	3.0	3.0	2.8	5.9	5.0	1.5	0.4	0.5	0.5	0.4
d56914e	63.342850	63.342850	0.000	discard	stateless MLP policy (no LSTM) ent=0.10 gamma=0.999 lr=0.001 bptt=64 gae=0.95 minibatch=8192 20min — hypothesis: LSTM recurrent state accumulation causes gradient instability at 25min+; stateless policy has no such accumulation and may be more stable; comparing against 552.6j LSTM baseline at 20min	1243			337.9	0.0	1188516.6	0.1	0.0	2644259.8	2.7	4751.3	3440.7	0.0	4.6	5.1	5.6	4.0	3.2	0.8	0.2	0.2	0.2	0.2
acb0e3f	68.463891	68.463891	0.000	discard	LSTM ent=0.07 gamma=0.999 lr=0.001 bptt=64 gae=0.95 minibatch=8192 20min — lower entropy test; trend: ent=0.10→552j > ent=0.15→541j, testing if ent=0.07 continues improvement; hypothesis: less entropy = more focused exploitation = better junction holding at 20min	1238			0.0	0.0	1196417.9	0.0	0.0	3097995.0	2.6	4072.5	4009.0	0.0	2.5	10.9	9.1	10.2	11.5	2.2	0.2	0.2	0.3	0.2
1b00553	63.094517	63.094517	0.000	keep	LSTM ent=0.10 gamma=0.999 lr=0.001 bptt=64 gae=0.95 minibatch=8192 vector_batch_size=256 20min — doubled rollout length (default=128); 256*64=16384 transitions/update; 2 gradient steps per rollout; hypothesis: LSTM sees 4 BPTT segments per seq (vs 2 with default=128), enabling better long-term temporal credit assignment for junction holding	1239			99.4	0.0	1194105.0	0.0	0.0	2679822.9	2.1	4462.5	3630.3	0.0	0.0	16.8	17.0	17.2	17.2	2.5	0.1	0.1	0.1	0.1
crash-pre	0.000000	0.000000	0.000	crash	class=baseline policy CRASH — invalid policy class name (ModuleNotFoundError: Invalid symbol name: baseline); no training ran; immediately pivoted to class=puffer	0				0.0	0.0	0.0	0.0	0.0	0.0	0.0	0.0	0.0	0.0	0.0	0.0	0.0	0.0	0.0	0.0	0.0	0.0	0.0	0.0
4e68c9c	64.976081	64.976081	0.000	keep	puffer policy class ent=0.10 gamma=0.999 lr=0.001 bptt=64 gae=0.95 minibatch=8192 20min — PufferLib 4.0 LSTM architecture (GELU encoder + LSTMWrapper + std=0.01 action head); UNTESTED; all LSTM/stateless tested (LSTM=552j best, stateless=338j); hypothesis: different LSTM architecture may show different learning dynamics	1253			23.5	0.0	1194105.0	0.0	0.0	2636797.8	4.0	4853.9	3282.9	0.0	2.5	2.8	3.9	6.4	5.9	0.8	0.4	0.4	0.4	0.2
f4d49f9	44.479827	44.479827	0.000	keep	LSTM ent=0.10 bptt=64 gae=0.95 lr=0.001 minibatch=8192 10min — BPTT=64 at 10min NEVER TESTED; best 10min was BPTT=128+ent=0.15→1029.8j; BPTT=64 massively improved 20min (162j→552j); testing if same benefit at 10min; using ent=0.10 (best 20min entropy)	639			87.4	0.0	1196953.4	0.0	0.0	1807877.8	1.4	4393.1	3740.5	0.0	3.0	5.4	4.5	6.9	4.1	0.9	0.3	0.3	0.3	0.2
38b180d	57.079018	57.079018	0.000	keep	LSTM ent=0.10 two-phase BPTT=128→64 gae=0.95 lr=0.001 minibatch=8192 20min — two-phase training: Phase1=BPTT128/10min(builds junctions), Phase2=BPTT64/10min-from-ckpt(avoids overtraining); exploits finding: BPTT=128 fast early(1029j@10m) but overtrain(162j@20m), BPTT=64 stable(552j@20m); best of both?	1240			170.9	0.0	1202056.2	0.1	0.0	2545188.4	3.0	4555.3	3578.2	0.0	1.0	4.8	6.2	7.5	5.0	1.6	0.3	0.3	0.3	0.2
ac3e51c	3.367338	3.367338	0.000	keep	cogsguard_arena.basic LSTM ent=0.10 bptt=64 gae=0.95 lr=0.001 minibatch=8192 20min — NEW: compact 50x50 arena map (vs 88x88 machina) with 8 agents (vs 4); denser agent-to-map ratio means faster junction contact; all other hyperparams at best-known values; hypothesis: more junction interactions per time unit → more junctions at 20min; baseline: machina 552.6j (ae6f8d2)	1293			83.4	0.3	0.0	0.0	0.0	55854.2	1.0	642.6	165.4	0.0	5.5	11.5	9.0	11.1	10.9	1.9	0.2	0.3	0.2	0.1
804fc20	62.734714	62.734714	0.000	discard	milestones_2:50 + role_conditional + penalize_vibe_change LSTM ent=0.10 bptt=64 gae=0.95 lr=0.001 minibatch=8192 machina 20min — NEW: milestone weight 50 (double the :25 that gave 552.6j at ae6f8d2); only :25 tested at 20min, higher weight may push agents harder toward junction control; all other hyperparams at best-known values	1245			46.2	0.0	1196417.9	0.0	0.0	2637989.1	3.8	4626.6	3507.5	0.0	2.0	5.1	5.6	8.5	13.5	1.9	0.3	0.4	0.4	0.3
2d6a3c3	69.318994	69.318994	0.000	keep	milestones_2:25 + role_conditional (NO penalize_vibe_change) LSTM ent=0.10 bptt=64 gae=0.95 lr=0.001 minibatch=8192 machina 20min — FIRST TEST: removing penalize_vibe_change from best combo (552.6j baseline); penalize_vibe_change has been in EVERY experiment but never isolated; with role_conditional providing role differentiation, vibe penalty may be redundant or harmful	1251			24.0	0.0	1203147.0	0.0	0.0	2659685.7	2.2	4506.9	3627.7	0.0	1.7	5.1	5.2	3.0	4.6	0.8	0.4	0.3	0.3	0.4
2071af5	64.701858	64.701858	0.000	keep	milestones_2:20 + role_conditional + penalize_vibe_change LSTM ent=0.10 bptt=64 gae=0.95 lr=0.001 minibatch=8192 machina 25min — NOVEL: lower compounding factor (:20 vs best :25) to test if reduced reward intensity combats overtraining at 25min; :25@20min=552.6j, :25@25min=390j (29% drop), :50@20min=46j (fail); hypothesis: :20 less aggressive = more stable policy at 25min, potentially >552.6j at 25min; all other hyperparams at best-known values	1557			0.0	0.0	1191714.5	0.0	0.0	2541685.5	2.7	4510.2	3598.3	0.0	4.0	8.6	9.0	10.6	10.2	2.0	0.2	0.3	0.2	0.2
67a1741	86.187110	86.187110	0.000	discard	milestones_2:25 + role_conditional + penalize_vibe_change LSTM ent=0.15 bptt=256 gae=0.95 lr=0.001 minibatch=8192 machina 9min — NOVEL: BPTT=256 at 10min extending BPTT upward; best 10min BPTT=128(1029j,96b72bf), BPTT=64 failed at 10min(87j); trend: smaller BPTT=worse at 10min; hypothesis BPTT=256 doubles context=more gradient signal per step=faster learning; using best 10min params (ent=0.15, lr=0.001)	572			632.6	0.0	1193838.1	0.1	0.0	2630635.0	2.3	4853.7	3217.1	0.0	4.0	6.6	8.0	7.8	5.4	1.4	0.2	0.2	0.3	0.2
